Id,Sentence,Category
0,play someth 1971 john bochum,PlayMusic
1,like give two rate abolit britain,RateBook
2,locat show return mr moto,SearchCreativeWork
3,game call neutral zone,SearchCreativeWork
4,give textbook zero 6 point,RateBook
5,add roy romana playlist,AddToPlaylist
6,play turbul wild streetdanz jeff buckl,PlayMusic
7,like see pictur telecom,SearchCreativeWork
8,go warm today saint martin port oxford,GetWeather
9,book tree restaur sent martin,BookRestaurant
10,get chiller within walk distanc pw,GetWeather
11,add opu de funk list acoust blue,AddToPlaylist
12,red e tobi nemiciamici start thirteen hour,SearchScreeningEvent
13,play song 2006,PlayMusic
14,find attack surfac analyz paint,SearchCreativeWork
15,pleas rate current textbook 5 star 6,RateBook
16,humid parc nation de killarney,GetWeather
17,add tunnel love ether metal crash cours playlist,AddToPlaylist
18,find schedul film star theatr,SearchScreeningEvent
19,play music mark heard,PlayMusic
20,play adrian brand music zoo,PlayMusic
21,weather forecast ten year mount victori macro,GetWeather
22,give zero / 6 star current album,RateBook
23,play music last fm,PlayMusic
24,movi time consolid theatr,SearchScreeningEvent
25,show immort grand prix,SearchCreativeWork
26,let play album handov deeper,PlayMusic
27,play playlist runtim,PlayMusic
28,rate hunt gather two,RateBook
29,cloudi georgia,GetWeather
30,tv seri puppet master : axi evil cancel,SearchCreativeWork
31,pleas provid rainbow mar seri zero 6 point,RateBook
32,find dead matter speakeasi theater,SearchScreeningEvent
33,add live dragon ballroom trade,AddToPlaylist
34,weather forecast sixteen oklahoma,GetWeather
35,rate novel three 6 star,RateBook
36,need time 21 minut,GetWeather
37,book union oyster hous iranica puerto rico,BookRestaurant
38,book spot colleagu pizzeria pool wing mill wisconsin,BookRestaurant
39,book tabl greec 4,BookRestaurant
40,third eye show wilkinson theatr,SearchScreeningEvent
41,weather go like near moldova fri,GetWeather
42,add tune epic classic playlist,AddToPlaylist
43,need book restaur fork mountain sc salari mari,BookRestaurant
44,play movement 1974,PlayMusic
45,want hear opera netflix,PlayMusic
46,book reserv seven peopl highli rate restaur serf morocco food east greenvil,BookRestaurant
47,go windi parkway valley fire,GetWeather
48,add melon mcdonough indi song glacier playlist artist,AddToPlaylist
49,like go dougla theatr compani see beaver valley time movi play,SearchScreeningEvent
50,what temperatur far valley fire,GetWeather
51,show day earth caught fire movi,SearchCreativeWork
52,play music seventi,PlayMusic
53,hear song american high,SearchCreativeWork
54,book spot ten upper marlboro pr,BookRestaurant
55,play music 1976 deeper,PlayMusic
56,feel like current place juli,GetWeather
57,rate voyag dark 3 6,RateBook
58,play song newest movement princ last,PlayMusic
59,play music jeremi taylor album dorm amor la situat non è bona groov shark,PlayMusic
60,play new music liang book,PlayMusic
61,maria carol rex get ad woman sxsw playlist,AddToPlaylist
62,reserv smoke room restaur,BookRestaurant
63,weather like far alabama may 9 2037,GetWeather
64,movi theatr clean sober closest,SearchScreeningEvent
65,contemporari religi pagan get 3 rate,RateBook
66,give list film play neighbourhood,SearchScreeningEvent
67,find saga school girl holly-day,SearchCreativeWork
68,ten weather like nearbi cypru,GetWeather
69,rate current novel 5 6 point,RateBook
70,add tune indi workout playlist,AddToPlaylist
71,show forecast 6 year westlak villag guinea,GetWeather
72,book restaur ten sunset,BookRestaurant
73,play someth unto,PlayMusic
74,want add kara sister futur hit playlist,AddToPlaylist
75,play maori mochida popular music googl music,PlayMusic
76,raini parkway charleston lake provinci park 13 hour,GetWeather
77,add hang danc aftercluv playlist,AddToPlaylist
78,play want erykah bad,PlayMusic
79,play song workout playlist groov shark,PlayMusic
80,check forecast arson around 9 pm,GetWeather
81,book reserv gastropod serv liver onion,BookRestaurant
82,add belgian rose even list,AddToPlaylist
83,includ past behind top 100 rock track spotifi playlist,AddToPlaylist
84,like hear helen taylor,PlayMusic
85,weather bystrzyca valley landscap park,GetWeather
86,book restaur macedonia 13 hour,BookRestaurant
87,find news seven-thirti photograph,SearchCreativeWork
88,give showtim tenth woman movi hous,SearchScreeningEvent
89,tell weather next week cathedr state park,GetWeather
90,find anim movi movi schedul neighborhood,SearchScreeningEvent
91,pleas search jardin australia saga,SearchCreativeWork
92,need book restaur parti nine thoma jefferson birthday,BookRestaurant
93,philli bogu mountain demonstr state forest,GetWeather
94,forest rate four,RateBook
95,find tabl restaur num ca 09:59 pm,BookRestaurant
96,find movi schedul star theatr,SearchScreeningEvent
97,timeless love song playlist includ viderunt one,AddToPlaylist
98,play latest thema obama,PlayMusic
99,like watch trailer tear go,SearchCreativeWork
100,want add chan tune latin altern music,AddToPlaylist
101,add semana kumar mukhopadhyay album funki jam,AddToPlaylist
102,tell weather forecast nine,GetWeather
103,octob 19th forecast iran,GetWeather
104,find paint call thunder sky,SearchCreativeWork
105,put track infinit indi folk playlist,AddToPlaylist
106,snowfal forecast pa,GetWeather
107,play nineti liga parti,PlayMusic
108,play krzysztof penderecki last fm,PlayMusic
109,find saison 7 de son anarchi,SearchCreativeWork
110,add album fairi tale,AddToPlaylist
111,give morn movi schedul,SearchScreeningEvent
112,show show goldimous three cat,SearchCreativeWork
113,movi schedul near,SearchScreeningEvent
114,incorpor roberto para sandov track cena eleg playlist,AddToPlaylist
115,anim movi show neighborhood,SearchScreeningEvent
116,give star trek : motion pictur five 6,RateBook
117,play music 1958 deeper,PlayMusic
118,weather turtl river state park,GetWeather
119,play tune two kansa citi missouri,PlayMusic
120,weather waretown lebanon,GetWeather
121,book restaur three peopl jenkin,BookRestaurant
122,search game last horror movi,SearchCreativeWork
123,add album romania ejercicio playlist,AddToPlaylist
124,play sound track ferri coaster,PlayMusic
125,want give eleph rememb 4 6 point,RateBook
126,play sixti track nom like heart,PlayMusic
127,play crucifixion deeper,PlayMusic
128,wish hear concerto dio 1952,PlayMusic
129,nine weather forecast nationalpark midongi du sud,GetWeather
130,weather like 56 week sun labor,GetWeather
131,find video game tomb,SearchCreativeWork
132,like get restaur book mar fourteenth md,BookRestaurant
133,termin station linemark theatr,SearchScreeningEvent
134,put sungmin summer playlist,AddToPlaylist
135,delanson 1 hour reserv tabl four,BookRestaurant
136,congress warmer weather,GetWeather
137,find movi accident love,SearchCreativeWork
138,play piano ballad netflix,PlayMusic
139,rate last opium den 0 point,RateBook
140,give four / 6 point empir death,RateBook
141,rate cross 3 6,RateBook
142,weather piperton rwanda,GetWeather
143,book reserv seven peopl bakeri usag citi,BookRestaurant
144,look american journal sociolog,SearchCreativeWork
145,tell film around,SearchScreeningEvent
146,like tabl five restaur,BookRestaurant
147,movi theatr matter wife death,SearchScreeningEvent
148,look paint last flight abus,SearchCreativeWork
149,winter meredith betti erik want food gastropod area fran locat,BookRestaurant
150,show photograph minut midnight,SearchCreativeWork
151,weather like india 02:55:25,GetWeather
152,show movi sonic tripl troubl,SearchCreativeWork
153,find paint call break,SearchCreativeWork
154,find tv show ask woman know,SearchCreativeWork
155,play blue vimeo,PlayMusic
156,give last novel 1 point,RateBook
157,book nearbi mention grand hotel call missouri,BookRestaurant
158,look novel call adventur logo ii,SearchCreativeWork
159,like watch movi right nearbi,SearchScreeningEvent
160,add mina auto album hour parti,AddToPlaylist
161,give schedul get : sweet 16 licens drive,SearchScreeningEvent
162,play erin hare fifti last,PlayMusic
163,add artist primera sound 2016 barcelona,AddToPlaylist
164,want eat scandinavian restaur highli rate berita texa,BookRestaurant
165,find schedul cup winner closest movi hous,SearchScreeningEvent
166,googl music play top singl releas 1972,PlayMusic
167,get showtim film wilkinson theatr,SearchScreeningEvent
168,great scienc fiction stori mar seri deserv rate zero,RateBook
169,add tune hart wand wagner,AddToPlaylist
170,find half truth,SearchScreeningEvent
171,rate current album one point,RateBook
172,chronicl get three 6,RateBook
173,time one night stand show cineplex corpor,SearchScreeningEvent
174,weather like colorado,GetWeather
175,add corner bowel relax playlist,AddToPlaylist
176,play chant fifti,PlayMusic
177,play chant music 2008,PlayMusic
178,add album adrenalin workout,AddToPlaylist
179,add matchid electro latino,AddToPlaylist
180,book spot one wolseley eleven,BookRestaurant
181,find could fall love,SearchCreativeWork
182,film play marcu corpor,SearchScreeningEvent
183,find photograph among live,SearchCreativeWork
184,add artist latin pop hit,AddToPlaylist
185,time thick thief play santo theatr,SearchScreeningEvent
186,rate seri one star,RateBook
187,find creol restaur,BookRestaurant
188,movi play closest movi hous,SearchScreeningEvent
189,weather like midfield iowa today,GetWeather
190,rate current essay one 6,RateBook
191,add yesterday last ep afternoon train ride playlist,AddToPlaylist
192,give five star gener saga,RateBook
193,fraud : mind medalist rate 2 star best rate 6,RateBook
194,rate book seri section three 6 star,RateBook
195,need book pub 8 wifi,BookRestaurant
196,play ukasz gottwald album zoo,PlayMusic
197,like hear one eric clayton popular melodi pandora,PlayMusic
198,midnight forecast argentina,GetWeather
199,umbrella cherbourg play near,SearchScreeningEvent
200,use groov shark play today tomorrow album,PlayMusic
201,find novel call best hit live : save child speed live 2003,SearchCreativeWork
202,rate current essay 1 star,RateBook
203,warmer ristigouch ecolog reserv nov twentieth,GetWeather
204,show movi schedul movi play around today,SearchScreeningEvent
205,cold chatmoss albania 8 year half,GetWeather
206,movi schedul b & b theatr look like,SearchScreeningEvent
207,play mark tremonti thirti,PlayMusic
208,warm zambia 9 pm,GetWeather
209,weather close-bi parc nation de kolkheti,GetWeather
210,book tabl skyciti salad hannah,BookRestaurant
211,find project album,SearchCreativeWork
212,check weather forecast chisholm kentucki,GetWeather
213,feel zero 6 point would rate queen dawn,RateBook
214,weather mount oliv,GetWeather
215,book reserv nine outdoor restaur,BookRestaurant
216,add abbr ul haq track playlist soul loung,AddToPlaylist
217,pleas play song 1959,PlayMusic
218,book restaur 2 cafe get croissant,BookRestaurant
219,play 1966 theme music lack,PlayMusic
220,want tabl eight maximum rhode island,BookRestaurant
221,find cast crown discographi,SearchCreativeWork
222,like book reserv next spring nine peopl shore club,BookRestaurant
223,get johnni cool photograph,SearchCreativeWork
224,time dare doberman play,SearchScreeningEvent
225,play jeff wilson youtub,PlayMusic
226,current sell price novel sim 3 : island paradis,SearchCreativeWork
227,get movi schedul 8,SearchScreeningEvent
228,add ali loan song club hit,AddToPlaylist
229,mississippi week,GetWeather
230,play twenti track aj brother zoo,PlayMusic
231,rate step two 6 point,RateBook
232,pleas search lover trailer,SearchCreativeWork
233,film play closest cinema,SearchScreeningEvent
234,raini monday le center thailand,GetWeather
235,rate equal affect one point,RateBook
236,time ball ano hous play,SearchScreeningEvent
237,add extend play woman lit playlist,AddToPlaylist
238,find upon time west,SearchCreativeWork
239,find reserv sunset gastropod 2 peopl,BookRestaurant
240,find time hash,SearchScreeningEvent
241,show movi schedul,SearchScreeningEvent
242,movi schedul amc theater,SearchScreeningEvent
243,freez 06:31:22,GetWeather
244,wildorado hot temperatur,GetWeather
245,add andé calamaro milk,AddToPlaylist
246,rate essay four 6,RateBook
247,add década list neo da matrix,AddToPlaylist
248,add mc ren southern thing playlist,AddToPlaylist
249,see boat peopl,SearchCreativeWork
250,book restaur martin luther king jr day park,BookRestaurant
251,book reserv seven peopl teahous kenya,BookRestaurant
252,play tina cousin 1956,PlayMusic
253,find novel peac arch news,SearchCreativeWork
254,weather current place,GetWeather
255,book tabl nine peopl next mar,BookRestaurant
256,seri get 2 6 star,RateBook
257,includ union say trap land playlist,AddToPlaylist
258,play music 2012 googl music,PlayMusic
259,forecast start septemb 1 2039 chiller condit ak,GetWeather
260,give two point 6 essay,RateBook
261,play someth kid workout playlist groov shark,PlayMusic
262,would rate album 3,RateBook
263,rate current essay 2 6,RateBook
264,rate current album 2,RateBook
265,need find restaur pw,BookRestaurant
266,play danc life ronald isl spotifi,PlayMusic
267,play avantgard music netflix,PlayMusic
268,sunni spain 3/26/2023,GetWeather
269,show movi schedul,SearchScreeningEvent
270,humid like left,GetWeather
271,rate chang 0 6 point,RateBook
272,add statu roundhous funk playlist,AddToPlaylist
273,play song best siouxsi & banshe austin drama,PlayMusic
274,much hotter tomorrow,GetWeather
275,book tabl 9 peopl four pm johnson,BookRestaurant
276,find black girl search god trailer,SearchCreativeWork
277,see trailer take king,SearchCreativeWork
278,time rite spring play marcu corpor,SearchScreeningEvent
279,weather nationalpark rica nov 25,GetWeather
280,want book spot bar jennif north dakota,BookRestaurant
281,book goali stewart even restaur,BookRestaurant
282,add name coven playlist fusion fest,AddToPlaylist
283,add bank violenc inner life today retro game playlist,AddToPlaylist
284,add ila playlist mi mantra recopilatorio name heart stood still,AddToPlaylist
285,book tabl 2 guest restaur lazi mountain ny,BookRestaurant
286,want give pilgrim wayn three 6 star,RateBook
287,add song philip glass,AddToPlaylist
288,6 give follow book zero,RateBook
289,rate seri five 6,RateBook
290,get seat 5 peopl 1 minut tuvalu,BookRestaurant
291,add sonata assassin creed,AddToPlaylist
292,add alreadi pt 2 hip hop 2017 new school,AddToPlaylist
293,snowi foreword state park,GetWeather
294,book restaur fl citi lochearn step son,BookRestaurant
295,give 0 6 star realiti certainti,RateBook
296,rate current essay 5 6,RateBook
297,add nib may brooklyn beat playlist,AddToPlaylist
298,find reserv browa water inn australia 2 year,BookRestaurant
299,play nuestro 80 playlist,PlayMusic
300,rate current novel one 6,RateBook
301,rate textbook 2 6 star,RateBook
302,rate book five,RateBook
303,want see overtim touch paint,SearchCreativeWork
304,book restaur serf hot chicken dutch mill north dakota 10 peopl 3,BookRestaurant
305,still warm nineteen hour pa,GetWeather
306,rate current essay zero 6,RateBook
307,book highli rate restaur northeastern 10 atlanta,BookRestaurant
308,nake dead pretti good give four star,RateBook
309,add desert session love 80 rollerdisco playlist,AddToPlaylist
310,search un provinci new york tv show,SearchCreativeWork
311,find deathsmil ii soundtrack,SearchCreativeWork
312,need popular morocco cafeteria,BookRestaurant
313,young guard play closest cinema,SearchScreeningEvent
314,find cluster comput game,SearchCreativeWork
315,find photograph call day,SearchCreativeWork
316,need reserv one eighti els wendi muscl,BookRestaurant
317,pleas book tabl three american gastropod,BookRestaurant
318,find movi hous hollow reed,SearchScreeningEvent
319,give zero 6 point maxim oppress woman,RateBook
320,movi schedul area anim movi,SearchScreeningEvent
321,movi time,SearchScreeningEvent
322,book spot restaur parkway 138th st,BookRestaurant
323,give previou saga 4 6,RateBook
324,rate eat fri worm two star,RateBook
325,need cambodia brasseri restaur top-rat,BookRestaurant
326,book tabl seven peopl restaur internet,BookRestaurant
327,want add johnni burk countri bound playlist,AddToPlaylist
328,rate tritonian ring zero,RateBook
329,movi schedul low cineplex entertain,SearchScreeningEvent
330,find photograph journal,SearchCreativeWork
331,convoy buster play,SearchScreeningEvent
332,film movi schedul area,SearchScreeningEvent
333,see tv show closer get,SearchCreativeWork
334,add hate want die six string peac,AddToPlaylist
335,find haunt castl,SearchCreativeWork
336,find nearest movi theatr movi,SearchScreeningEvent
337,book restaur 4 u,BookRestaurant
338,search paint smart money,SearchCreativeWork
339,time age success show,SearchScreeningEvent
340,add track gold school playlist,AddToPlaylist
341,pull american music award 1975,SearchCreativeWork
342,film play marco theatr,SearchScreeningEvent
343,know anim movi schedul neighbourhood,SearchScreeningEvent
344,watch tv show terrorist : kid sentenc,SearchCreativeWork
345,find tv show school teacher hous,SearchCreativeWork
346,anim movi play neighborhood,SearchScreeningEvent
347,add spirit life nação regga,AddToPlaylist
348,add tartan madrugando playlist,AddToPlaylist
349,add total stress free bobbi lord playlist,AddToPlaylist
